{
  "$schema": "https://json-schema.org/draft/2020-12/schema",
  "$id": "https://local.ds160/intake-v1.schema.json",
  "title": "DS-160 Intake V1",
  "description": "Canonical minimal intake payload for China B1/B2 applicants. This is the fixed JSON contract for the first-pass local dossier builder.",
  "type": "object",
  "additionalProperties": false,
  "properties": {
    "surname": {
      "type": "string",
      "description": "Passport surname in English uppercase-preferred form.",
      "minLength": 1
    },
    "given_names": {
      "type": "string",
      "description": "Passport given names in English uppercase-preferred form.",
      "minLength": 1
    },
    "native_full_name": {
      "type": [
        "string",
        "null"
      ],
      "description": "Applicant full name in native alphabet, usually Chinese."
    },
    "sex": {
      "type": "string",
      "enum": [
        "MALE",
        "FEMALE"
      ]
    },
    "marital_status": {
      "type": "string",
      "enum": [
        "SINGLE",
        "MARRIED",
        "DIVORCED",
        "WIDOWED"
      ]
    },
    "date_of_birth": {
      "type": "string",
      "format": "date",
      "description": "YYYY-MM-DD"
    },
    "birth_city": {
      "type": "string",
      "minLength": 1
    },
    "passport_number": {
      "type": "string",
      "minLength": 1
    },
    "passport_issue_date": {
      "type": "string",
      "format": "date"
    },
    "passport_expiration_date": {
      "type": "string",
      "format": "date"
    },
    "trip_purpose": {
      "type": "string",
      "enum": [
        "business_tourism",
        "business",
        "tourism",
        "family_visit"
      ],
      "description": "V1 keeps visa class fixed to B1/B2 and only asks for the user-facing trip purpose bucket."
    },
    "intended_arrival_date": {
      "type": "string",
      "format": "date"
    },
    "intended_length_of_stay_value": {
      "type": "string",
      "minLength": 1,
      "description": "Stored as string to preserve direct user input."
    },
    "intended_length_of_stay_unit": {
      "type": "string",
      "enum": [
        "DAYS",
        "WEEKS",
        "MONTHS"
      ]
    },
    "payer_name": {
      "type": "string",
      "minLength": 1
    },
    "us_contact_name": {
      "type": "string",
      "minLength": 1
    },
    "us_contact_organization": {
      "type": [
        "string",
        "null"
      ]
    },
    "us_contact_phone": {
      "type": "string",
      "minLength": 1
    },
    "us_contact_address_line1": {
      "type": "string",
      "minLength": 1
    },
    "us_contact_city": {
      "type": "string",
      "minLength": 1
    },
    "us_contact_state": {
      "type": "string",
      "minLength": 1,
      "description": "State name or postal abbreviation. Builder currently normalizes to uppercase only."
    },
    "us_contact_postal_code": {
      "type": "string",
      "minLength": 1
    },
    "us_contact_email": {
      "type": [
        "string",
        "null"
      ],
      "format": "email"
    },
    "primary_occupation": {
      "type": "string",
      "enum": [
        "BUSINESSPERSON",
        "STUDENT",
        "OTHER"
      ]
    },
    "current_employer_name": {
      "type": "string",
      "minLength": 1
    },
    "current_employer_address": {
      "type": "string",
      "minLength": 1
    },
    "father_full_name": {
      "type": "string",
      "minLength": 1
    },
    "mother_full_name": {
      "type": "string",
      "minLength": 1
    },
    "spouse_full_name": {
      "type": [
        "string",
        "null"
      ],
      "description": "Optional in V1. Empty/null allowed for unmarried applicants."
    },
    "communicable_disease": {
      "type": "boolean",
      "default": false
    },
    "arrest_history": {
      "type": "boolean",
      "default": false
    }
  },
  "required": [
    "surname",
    "given_names",
    "sex",
    "marital_status",
    "date_of_birth",
    "birth_city",
    "passport_number",
    "passport_issue_date",
    "passport_expiration_date",
    "trip_purpose",
    "intended_arrival_date",
    "intended_length_of_stay_value",
    "intended_length_of_stay_unit",
    "payer_name",
    "us_contact_name",
    "us_contact_phone",
    "us_contact_address_line1",
    "us_contact_city",
    "us_contact_state",
    "us_contact_postal_code",
    "primary_occupation",
    "current_employer_name",
    "current_employer_address",
    "father_full_name",
    "mother_full_name",
    "communicable_disease",
    "arrest_history"
  ]
}
