{
  "surname": "ZHANG",
  "given_names": "WEI",
  "native_full_name": "张伟",
  "sex": "MALE",
  "marital_status": "MARRIED",
  "date_of_birth": "1990-08-15",
  "birth_city": "Shanghai",
  "passport_number": "E12345678",
  "passport_issue_date": "2023-05-12",
  "passport_expiration_date": "2033-05-11",
  "trip_purpose": "business_tourism",
  "intended_arrival_date": "2026-09-10",
  "intended_length_of_stay_value": "12",
  "intended_length_of_stay_unit": "DAYS",
  "payer_name": "Shanghai Example Trading Co., Ltd.",
  "us_contact_name": "Michael Chen",
  "us_contact_organization": "Example US Imports",
  "us_contact_phone": "+1 415 555 0187",
  "us_contact_address_line1": "500 Market Street",
  "us_contact_city": "San Francisco",
  "us_contact_state": "California",
  "us_contact_postal_code": "94105",
  "us_contact_email": "mchen@example.com",
  "primary_occupation": "BUSINESSPERSON",
  "current_employer_name": "Shanghai Example Trading Co., Ltd.",
  "current_employer_address": "88 Huaihai Middle Road, Shanghai, China",
  "father_full_name": "ZHANG JIANGUO",
  "mother_full_name": "LI HUA",
  "spouse_full_name": "WANG LI",
  "communicable_disease": false,
  "arrest_history": false
}
