{
  "surname": "LI",
  "given_names": "TEST USER",
  "native_full_name": "李测试",
  "sex": "MALE",
  "marital_status": "SINGLE",
  "date_of_birth": "1992-03-14",
  "birth_city": "Beijing",
  "passport_number": "E98765432",
  "passport_issue_date": "2024-01-08",
  "passport_expiration_date": "2034-01-07",
  "trip_purpose": "tourism",
  "intended_arrival_date": "2026-10-06",
  "intended_length_of_stay_value": "10",
  "intended_length_of_stay_unit": "DAYS",
  "payer_name": "Self",
  "us_contact_name": "Test Hotel Front Desk",
  "us_contact_organization": "Test Stay Suites",
  "us_contact_phone": "+1 212 555 0109",
  "us_contact_address_line1": "123 Example Avenue",
  "us_contact_city": "New York",
  "us_contact_state": "New York",
  "us_contact_postal_code": "10001",
  "us_contact_email": "frontdesk@example-stay.test",
  "primary_occupation": "OTHER",
  "current_employer_name": "Demo Trading Co., Ltd.",
  "current_employer_address": "100 Test Road, Chaoyang District, Beijing, China",
  "father_full_name": "LI FATHER",
  "mother_full_name": "WANG MOTHER",
  "spouse_full_name": null,
  "communicable_disease": false,
  "arrest_history": false
}
